{
  "schema": "https://ai-atoms.com/schemas/tool-v1.json",
  "type": "tool",
  "id": "tool/send-message",
  "version": "1.0.0",
  "name": "send-message",
  "description": "Send a message to an external channel (Slack, email, etc.). External, side-effecting.",
  "subtype": "command",
  "spec": {
    "function_name": "send_message",
    "summary": "Send a message to a channel.",
    "parameters": {
      "channel": {
        "type": "string",
        "description": "Channel identifier (slack://...; mailto:...)",
        "required": true
      },
      "subject": {
        "type": "string",
        "description": "Subject / title",
        "required": false
      },
      "body": {
        "type": "string",
        "description": "Message body",
        "required": true
      }
    },
    "returns": {
      "type": "object",
      "description": "{sent, message_id}."
    },
    "side_effects": [
      "network",
      "user-prompt"
    ]
  },
  "authored_by": "convergent-systems-key",
  "source_url": "https://github.com/convergent-systems-co/agent-atoms/blob/main/atoms/tool-definition/send-message.json",
  "category": "devops",
  "provenance": {
    "source": "convergent-systems-co/agent-atoms",
    "source_url": "https://github.com/convergent-systems-co/agent-atoms/blob/main/atoms/tool-definition/send-message.json",
    "author": "convergent-systems-co",
    "license": "Apache-2.0",
    "notes": "Re-typed from tool-definition by scripts/migrate-policy-tool.py."
  },
  "lifecycle": "stable"
}
